{
  "EMSX_TICKER": "example_value",
  "EMSX_AMOUNT": 10,
  "EMSX_ORDER_TYPE": "example_value",
  "EMSX_SIDE": "example_value",
  "EMSX_TIF": "example_value",
  "EMSX_LIMIT_PRICE": 42.5,
  "EMSX_STOP_PRICE": 42.5,
  "EMSX_ACCOUNT": "example_value",
  "EMSX_NOTES": "example_value",
  "EMSX_HAND_INSTRUCTION": "example_value",
  "EMSX_BASKET_NAME": "example_value",
  "EMSX_CFD_FLAG": "example_value",
  "EMSX_CUSTOM_NOTE1": "example_value",
  "EMSX_CUSTOM_NOTE2": "example_value",
  "EMSX_CUSTOM_NOTE3": "example_value",
  "EMSX_CUSTOM_NOTE4": "example_value",
  "EMSX_CUSTOM_NOTE5": "example_value",
  "EMSX_GTD_DATE": "example_value",
  "EMSX_INVESTOR_ID": "500123",
  "EMSX_LOCATE_BROKER": "example_value",
  "EMSX_LOCATE_ID": "500123",
  "EMSX_PORTFOLIO": "example_value"
}